{
  "specversion": "1.0",
  "id": "01a12d2b-6c24-7606-85a1-00fe473b430e",
  "source": "/kernel/farm-camps-01",
  "type": "campsverso.world.item.created.v1",
  "time": "2026-10-11T22:00:00Z",
  "datacontenttype": "application/json",
  "dataschema": "contracts://events/world/item.created.v1",
  "worldid": "farm-camps-01",
  "cartridge": "farm_camps",
  "tick": 64,
  "simtime": "2026-03-02T07:04:00-03:00",
  "seq": 13,
  "provenance": "simulated",
  "visibility": "world",
  "data": {
    "item": "rabanete",
    "qty": 1,
    "container_id": "camps",
    "reason": "harvest",
    "action_id": "act-000120",
    "expires_day": 7
  }
}
