{
  "specversion": "1.0",
  "id": "01a12d2b-6c1d-7670-9f5b-49c93d5575ea",
  "source": "/kernel/farm-camps-01",
  "type": "campsverso.world.clock.paused.v1",
  "time": "2026-10-11T22:00:00Z",
  "datacontenttype": "application/json",
  "dataschema": "contracts://events/world/clock.paused.v1",
  "worldid": "farm-camps-01",
  "cartridge": "farm_camps",
  "tick": 64,
  "simtime": "2026-03-02T07:04:00-03:00",
  "seq": 5,
  "provenance": "simulated",
  "visibility": "world",
  "data": {
    "reason": "debug",
    "by": "human/operator"
  }
}
