{
  "specversion": "1.0",
  "id": "01a1fa10-1c24-7606-85a1-00fe473b4403",
  "source": "/kernel/farm-camps-01",
  "type": "campsverso.farm.crop.eaten.v1",
  "time": "2026-10-11T22:00:00Z",
  "datacontenttype": "application/json",
  "dataschema": "contracts://events/farm/crop.eaten.v1",
  "worldid": "farm-morada-do-sol-01",
  "cartridge": "farm_morada_do_sol",
  "tick": 5760,
  "simtime": "2026-10-14T06:00:00-03:00",
  "seq": 2610,
  "provenance": "simulated",
  "visibility": "world",
  "data": {
    "plot_id": "plot-012",
    "crop": "milho",
    "day": 5,
    "by": "corvo"
  }
}
