{
  "specversion": "1.0",
  "id": "01a12d2b-6c19-741f-b36f-a6baac34ecad",
  "source": "/kernel/farm-camps-01",
  "type": "campsverso.world.clock.phase_changed.v1",
  "time": "2026-10-11T22:00:00Z",
  "datacontenttype": "application/json",
  "dataschema": "contracts://events/world/clock.phase_changed.v1",
  "worldid": "farm-camps-01",
  "cartridge": "farm_camps",
  "tick": 64,
  "simtime": "2026-03-02T07:04:00-03:00",
  "seq": 2,
  "provenance": "simulated",
  "visibility": "world",
  "data": {
    "phase": "amanhecer",
    "day": 2
  }
}
