{
  "specversion": "1.0",
  "id": "01a12d2b-6c33-700a-91d1-e12421c4eb62",
  "source": "/gateway/operator",
  "type": "campsverso.cmd.avatar.possess.v1",
  "time": "2026-10-11T22:00:00Z",
  "datacontenttype": "application/json",
  "dataschema": "contracts://commands/avatar/possess.v1",
  "worldid": "farm-camps-01",
  "cartridge": "farm_camps",
  "tick": 64,
  "simtime": "2026-03-02T07:04:00-03:00",
  "seq": 40,
  "provenance": "simulated",
  "visibility": "observer",
  "data": {
    "avatar_id": "camps",
    "controller": {
      "type": "human",
      "id": "human/camps-browser"
    }
  },
  "actor": "human/operator"
}
