{
  "specversion": "1.0",
  "id": "01a1fa10-1c24-7606-85a1-00fe473b4511",
  "source": "/kernel/farm-morada-do-sol-01",
  "type": "campsverso.economy.order.accepted.v1",
  "time": "2026-10-24T22:00:00Z",
  "datacontenttype": "application/json",
  "dataschema": "contracts://events/economy/order.accepted.v1",
  "worldid": "farm-morada-do-sol-01",
  "cartridge": "farm_morada_do_sol",
  "tick": 4321,
  "simtime": "2026-10-03T06:00:00-03:00",
  "seq": 1901,
  "provenance": "simulated",
  "visibility": "world",
  "data": {
    "order_id": "order-003",
    "taker": "camps",
    "day": 3
  }
}
