{
  "specversion": "1.0",
  "id": "01a12d2b-6c2b-73a8-95e1-f4e1cbc1537c",
  "source": "/kernel/farm-camps-01",
  "type": "campsverso.avatar.possessed.v1",
  "time": "2026-10-11T22:00:00Z",
  "datacontenttype": "application/json",
  "dataschema": "contracts://events/avatar/possessed.v1",
  "worldid": "farm-camps-01",
  "cartridge": "farm_camps",
  "tick": 64,
  "simtime": "2026-03-02T07:04:00-03:00",
  "seq": 24,
  "provenance": "simulated",
  "visibility": "world",
  "data": {
    "avatar_id": "camps",
    "previous_controller": {
      "type": "script",
      "id": "script/farmer-v1"
    },
    "controller": {
      "type": "human",
      "id": "human/camps-browser"
    },
    "by": "human/operator"
  }
}
